KLAC,KLA Corporation (XNAS:KLAC),5.00%,11.00%,4.00%,-16.00%,34.00%,-16.00%,-49.00%,29.00%
KMB,KIMBERLY-CLARK CORPORATION (XNAS:KMB),-0.00%,5.00%,-1.00%,-13.00%,11.00%,-13.00%,-1.00%,21.00%
KMI,"KINDER MORGAN, INC. (XNYS:KMI)",2.00%,6.00%,1.00%,-13.00%,16.00%,-13.00%,16.00%,3.00%
KO,THE COCA-COLA COMPANY (XNYS:KO),1.00%,5.00%,0.00%,-11.00%,15.00%,-11.00%,80.00%,22.00%
KR,THE KROGER CO. (XNYS:KR),2.00%,8.00%,0.00%,-15.00%,36.00%,-15.00%,541.00%,143.00%
KVUE,KENVUE INC. (XNYS:KVUE),-1.00%,6.00%,0.00%,0.00%,20.00%,-19.00%,263.00%,1.00%
L,LOEWS CORPORATION (XNYS:L),2.00%,4.00%,2.00%,-12.00%,11.00%,-12.00%,85.00%,-29.00%
LDOS,"LEIDOS HOLDINGS, INC. (XNYS:LDOS)",2.00%,8.00%,1.00%,-13.00%,24.00%,-13.00%,85.00%,59.00%
LEN,LENNAR CORPORATION (XNYS:LEN),1.00%,11.00%,0.00%,-22.00%,26.00%,-22.00%,-31.00%,35.00%
LH,LABCORP HOLDINGS INC. (XNYS:LH),1.00%,6.00%,-0.00%,4.00%,12.00%,-14.00%,-80.00%,-6.00%
LHX,"L3HARRIS TECHNOLOGIES, INC. (XNYS:LHX)",1.00%,6.00%,1.00%,-14.00%,22.00%,-14.00%,167.00%,52.00%
LII,LENNOX INTERNATIONAL INC. (XNYS:LII),2.00%,9.00%,3.00%,-19.00%,19.00%,-19.00%,-32.00%,-14.00%
LIN,LINDE PUBLIC LIMITED COMPANY (XNAS:LIN),1.00%,6.00%,0.00%,-14.00%,15.00%,-14.00%,-10.00%,13.00%
LLY,ELI LILLY AND COMPANY (XNYS:LLY),3.00%,10.00%,3.00%,-19.00%,25.00%,-19.00%,-47.00%,13.00%
LMT,LOCKHEED MARTIN CORPORATION (XNYS:LMT),1.00%,7.00%,0.00%,-11.00%,25.00%,-11.00%,199.00%,100.00%
LNT,ALLIANT ENERGY CORPORATION (XNAS:LNT),1.00%,5.00%,1.00%,-15.00%,12.00%,-15.00%,79.00%,-43.00%
LOW,"LOWE'S COMPANIES, INC. (XNYS:LOW)",1.00%,8.00%,0.00%,-13.00%,25.00%,-13.00%,13.00%,44.00%
LRCX,LAM RESEARCH CORPORATION (XNAS:LRCX),4.00%,13.00%,3.00%,-19.00%,37.00%,-19.00%,-34.00%,25.00%
LULU,LULULEMON ATHLETICA INC. (XNAS:LULU),0.00%,12.00%,1.00%,-29.00%,24.00%,-29.00%,-67.00%,3.00%
LUV,SOUTHWEST AIRLINES CO. (XNYS:LUV),1.00%,11.00%,1.00%,-22.00%,26.00%,-22.00%,5.00%,22.00%
LVS,LAS VEGAS SANDS CORP. (XNYS:LVS),1.00%,12.00%,0.00%,-24.00%,32.00%,-24.00%,42.00%,44.00%
LW,"LAMB WESTON HOLDINGS, INC. (XNYS:LW)",-1.00%,12.00%,-1.00%,-33.00%,30.00%,-33.00%,65.00%,-38.00%
LYB,LyondellBasell Industries NV (XNYS:LYB),-1.00%,8.00%,-1.00%,-23.00%,18.00%,-23.00%,68.00%,-20.00%
LYV,"LIVE NATION ENTERTAINMENT, INC. (XNYS:LYV)",2.00%,10.00%,2.00%,-20.00%,25.00%,-20.00%,-34.00%,-9.00%
MA,MANILA MINING CORPORATION (XPHS:MA),1.00%,21.00%,-3.00%,0.00%,82.00%,-31.00%,539.00%,210.00%
MAA,"MID-AMERICA APARTMENT COMMUNITIES, INC. (XNYS:MAA)",0.00%,6.00%,1.00%,-13.00%,12.00%,-13.00%,-66.00%,-24.00%
MAR,"MARRIOTT INTERNATIONAL, INC. (XNAS:MAR)",2.00%,8.00%,1.00%,-16.00%,18.00%,-16.00%,-12.00%,11.00%
MAS,MASCO CORPORATION (XNYS:MAS),0.00%,9.00%,-1.00%,-12.00%,19.00%,-12.00%,-82.00%,39.00%
MCD,MCDONALD'S CORPORATION (XNYS:MCD),1.00%,6.00%,0.00%,-10.00%,19.00%,-10.00%,113.00%,62.00%
MCHP,MICROCHIP TECHNOLOGY INCORPORATED (XNAS:MCHP),2.00%,12.00%,-1.00%,-28.00%,46.00%,-28.00%,205.00%,88.00%
MCK,MCKESSON CORPORATION (XNYS:MCK),3.00%,6.00%,2.00%,-9.00%,22.00%,-9.00%,49.00%,59.00%
MCO,MOODY'S CORPORATION (XNYS:MCO),1.00%,7.00%,2.00%,-17.00%,17.00%,-17.00%,-43.00%,-17.00%
MDLZ,"Mondelez International, Inc. (XNAS:MDLZ)",0.00%,6.00%,0.00%,-13.00%,15.00%,-13.00%,-31.00%,35.00%
MDT,MEDTRONIC PUBLIC LIMITED COMPANY (XNYS:MDT),-0.00%,6.00%,0.00%,-14.00%,15.00%,-14.00%,5.00%,15.00%
MET,"METLIFE, INC. (XNYS:MET)",2.00%,7.00%,1.00%,-19.00%,22.00%,-19.00%,87.00%,30.00%
META,"Meta Platforms, Inc. (XNAS:META)",2.00%,14.00%,2.00%,-34.00%,55.00%,-34.00%,270.00%,24.00%
MGM,MGM RESORTS INTERNATIONAL (XNYS:MGM),1.00%,10.00%,-0.00%,-6.00%,24.00%,-21.00%,-75.00%,21.00%
MKC,"MCCORMICK & COMPANY, INCORPORATED (XNYS:MKC)",-0.00%,8.00%,-1.00%,-18.00%,21.00%,-18.00%,10.00%,19.00%
MLM,"MARTIN MARIETTA MATERIALS, INC. (XNYS:MLM)",2.00%,7.00%,2.00%,-16.00%,20.00%,-16.00%,-9.00%,10.00%
MMC,"MARSH & MCLENNAN COMPANIES, INC. (XNYS:MMC)",1.00%,5.00%,1.00%,-12.00%,12.00%,-12.00%,-12.00%,-33.00%
MMM,3M COMPANY (XNYS:MMM),1.00%,9.00%,-1.00%,-15.00%,26.00%,-15.00%,57.00%,64.00%
MNST,MONSTER BEVERAGE CORPORATION (XNAS:MNST),1.00%,7.00%,0.00%,-12.00%,16.00%,-12.00%,-67.00%,7.00%
MO,"Altria Group, Inc. (XNYS:MO)",1.00%,7.00%,-0.00%,-15.00%,15.00%,-15.00%,8.00%,9.00%
MOH,"MOLINA HEALTHCARE, INC. (XNYS:MOH)",-0.00%,11.00%,0.00%,-39.00%,20.00%,-39.00%,227.00%,-97.00%
MOS,THE MOSAIC COMPANY (XNYS:MOS),1.00%,12.00%,-1.00%,-22.00%,50.00%,-22.00%,301.00%,130.00%
MPC,MARATHON PETROLEUM CORPORATION (XNYS:MPC),3.00%,10.00%,3.00%,-23.00%,25.00%,-23.00%,-11.00%,-3.00%
MPWR,"MONOLITHIC POWER SYSTEMS, INC. (XNAS:MPWR)",3.00%,14.00%,2.00%,-37.00%,46.00%,-37.00%,89.00%,25.00%
MRK,"MERCK & CO., INC. (XNYS:MRK)",1.00%,7.00%,1.00%,-18.00%,15.00%,-18.00%,-7.00%,-11.00%
MRNA,"MODERNA, INC. (XNAS:MRNA)",1.00%,24.00%,-1.00%,-36.00%,77.00%,-36.00%,136.00%,102.00%
MS,MORGAN STANLEY (XNYS:MS),2.00%,8.00%,1.00%,-15.00%,17.00%,-15.00%,-36.00%,-22.00%
MSCI,MSCI INC. (XNYS:MSCI),1.00%,8.00%,-1.00%,-21.00%,22.00%,-21.00%,36.00%,27.00%
MSFT,MICROSOFT CORPORATION (XNAS:MSFT),2.00%,7.00%,1.00%,-13.00%,22.00%,-13.00%,35.00%,47.00%
MSI,"MOTOROLA SOLUTIONS, INC. (XNYS:MSI)",2.00%,7.00%,3.00%,-17.00%,19.00%,-17.00%,75.00%,-48.00%
MTB,M&T BANK CORPORATION (XNYS:MTB),2.00%,9.00%,2.00%,-23.00%,21.00%,-23.00%,16.00%,-8.00%
MTCH,"MATCH GROUP, INC. (XNAS:MTCH)",-1.00%,12.00%,-1.00%,-32.00%,23.00%,-32.00%,-14.00%,-18.00%
MTD,METTLER-TOLEDO INTERNATIONAL INC. (XNYS:MTD),1.00%,9.00%,0.00%,-18.00%,24.00%,-18.00%,5.00%,21.00%
MU,"MICRON TECHNOLOGY, INC. (XNAS:MU)",4.00%,16.00%,3.00%,-32.00%,43.00%,-32.00%,15.00%,51.00%
NCLH,NORWEGIAN CRUISE LINE HOLDINGS LTD. (XNYS:NCLH),2.00%,18.00%,2.00%,-26.00%,50.00%,-26.00%,15.00%,63.00%
NDAQ,"NASDAQ, INC. (XNAS:NDAQ)",2.00%,7.00%,2.00%,-16.00%,17.00%,-16.00%,11.00%,-25.00%
NDSN,NORDSON CORPORATION (XNAS:NDSN),1.00%,7.00%,1.00%,-18.00%,14.00%,-18.00%,-6.00%,-42.00%
NEE,"NEXTERA ENERGY, INC. (XNYS:NEE)",0.00%,8.00%,0.00%,-19.00%,19.00%,-19.00%,4.00%,-10.00%
NEM,NEWMONT CORPORATION (XNYS:NEM),1.00%,11.00%,0.00%,-27.00%,27.00%,-27.00%,-14.00%,-11.00%
NFLX,"NETFLIX, INC. (XNAS:NFLX)",2.00%,13.00%,3.00%,-52.00%,26.00%,-52.00%,433.00%,-122.00%
NI,NISOURCE INC. (XNYS:NI),1.00%,5.00%,2.00%,-17.00%,13.00%,-17.00%,153.00%,-54.00%
NKE,"NIKE, INC. (XNYS:NKE)",-1.00%,10.00%,-3.00%,-25.00%,22.00%,-25.00%,42.00%,19.00%
NOC,NORTHROP GRUMMAN CORPORATION (XNYS:NOC),2.00%,7.00%,1.00%,-19.00%,23.00%,-19.00%,117.00%,15.00%
NOW,"SERVICENOW, INC. (XNYS:NOW)",1.00%,11.00%,-0.00%,-18.00%,30.00%,-18.00%,13.00%,43.00%
NRG,"NRG ENERGY, INC. (XNYS:NRG)",4.00%,12.00%,3.00%,-23.00%,61.00%,-23.00%,870.00%,189.00%
NSC,NORFOLK SOUTHERN CORPORATION (XNYS:NSC),1.00%,7.00%,1.00%,-17.00%,17.00%,-17.00%,-46.00%,-12.00%
NTAP,"NETAPP, INC. (XNAS:NTAP)",2.00%,9.00%,0.00%,-23.00%,20.00%,-23.00%,57.00%,17.00%
NTRS,NORTHERN TRUST CORPORATION (XNAS:NTRS),2.00%,7.00%,2.00%,-11.00%,20.00%,-11.00%,-27.00%,45.00%
NUE,NUCOR CORPORATION (XNYS:NUE),3.00%,14.00%,1.00%,-24.00%,39.00%,-24.00%,35.00%,73.00%
NVDA,NVIDIA CORPORATION (XNAS:NVDA),6.00%,17.00%,4.00%,-30.00%,44.00%,-30.00%,-16.00%,29.00%
NVR,"NVR, Inc. (XNYS:NVR)",1.00%,7.00%,0.00%,-13.00%,20.00%,-13.00%,-36.00%,25.00%
NWS,NEWS CORPORATION (XNAS:NWS),2.00%,9.00%,1.00%,-24.00%,29.00%,-24.00%,198.00%,8.00%
NWSA,NEWS CORPORATION (XNAS:NWSA),2.00%,9.00%,1.00%,-22.00%,27.00%,-22.00%,147.00%,23.00%
NXPI,NXP Semiconductors NV (XNAS:NXPI),2.00%,10.00%,-0.00%,-17.00%,29.00%,-17.00%,1.00%,57.00%
O,REALTY INCOME CORPORATION (XNYS:O),-0.00%,6.00%,1.00%,-17.00%,9.00%,-17.00%,4.00%,-47.00%
ODFL,"OLD DOMINION FREIGHT LINE, INC. (XNAS:ODFL)",1.00%,11.00%,1.00%,-20.00%,31.00%,-20.00%,32.00%,45.00%
OKE,"ONEOK, INC. (XNYS:OKE)",2.00%,8.00%,2.00%,-21.00%,20.00%,-21.00%,44.00%,16.00%
OMC,OMNICOM GROUP INC. (XNYS:OMC),1.00%,7.00%,2.00%,-11.00%,18.00%,-11.00%,-54.00%,27.00%
ON,ON SEMICONDUCTOR CORPORATION (XNAS:ON),3.00%,13.00%,1.00%,-20.00%,44.00%,-20.00%,50.00%,56.00%
ORCL,ORACLE CORPORATION (XNYS:ORCL),3.00%,11.00%,4.00%,8.00%,28.00%,-24.00%,14.00%,2.00%
ORLY,"O'Reilly Automotive, Inc. (XNAS:ORLY)",2.00%,6.00%,3.00%,4.00%,16.00%,-11.00%,-44.00%,-17.00%
OTIS,OTIS WORLDWIDE CORPORATION (XNYS:OTIS),1.00%,6.00%,1.00%,-15.00%,15.00%,-15.00%,-3.00%,-6.00%
OXY,OCCIDENTAL PETROLEUM CORPORATION (XNYS:OXY),3.00%,13.00%,1.00%,-21.00%,49.00%,-21.00%,324.00%,144.00%
PANW,"PALO ALTO NETWORKS, INC. (XNAS:PANW)",2.00%,9.00%,2.00%,-19.00%,26.00%,-19.00%,16.00%,-2.00%
PAYC,"PAYCOM SOFTWARE, INC. (XNYS:PAYC)",-1.00%,12.00%,-1.00%,-31.00%,39.00%,-31.00%,119.00%,50.00%
PAYX,"PAYCHEX, INC. (XNAS:PAYX)",1.00%,6.00%,1.00%,-13.00%,17.00%,-13.00%,29.00%,-3.00%
PCAR,PACCAR INC (XNAS:PCAR),2.00%,7.00%,1.00%,-11.00%,18.00%,-11.00%,-51.00%,36.00%
PCG,PG&E CORPORATION (XNYS:PCG),2.00%,8.00%,2.00%,-22.00%,22.00%,-22.00%,111.00%,-3.00%
PEG,PUBLIC SERVICE ENTERPRISE GROUP INCORPORATED (XNYS:PEG),1.00%,5.00%,2.00%,-16.00%,14.00%,-16.00%,91.00%,-18.00%
PEP,"PEPSICO, INC. (XNAS:PEP)",0.00%,5.00%,1.00%,-9.00%,11.00%,-9.00%,-64.00%,4.00%
PFE,PFIZER INC. (XNYS:PFE),-0.00%,7.00%,-0.00%,-14.00%,13.00%,-14.00%,-49.00%,16.00%
PFG,"PRINCIPAL FINANCIAL GROUP, INC. (XNAS:PFG)",1.00%,7.00%,2.00%,-16.00%,25.00%,-16.00%,69.00%,26.00%
PG,THE PROCTER & GAMBLE COMPANY (XNYS:PG),0.00%,4.00%,0.00%,-11.00%,11.00%,-11.00%,20.00%,-1.00%
PGR,THE PROGRESSIVE CORPORATION (XNYS:PGR),2.00%,7.00%,1.00%,-11.00%,15.00%,-11.00%,-103.00%,-3.00%
PH,PARKER-HANNIFIN CORPORATION (XNYS:PH),3.00%,8.00%,2.00%,-12.00%,23.00%,-12.00%,-38.00%,51.00%
PHM,"PULTEGROUP, INC. (XNYS:PHM)",2.00%,10.00%,1.00%,-18.00%,29.00%,-18.00%,-17.00%,36.00%
PKG,PACKAGING CORPORATION OF AMERICA (XNYS:PKG),1.00%,7.00%,2.00%,3.00%,19.00%,-19.00%,29.00%,-10.00%
PLD,"PROLOGIS, INC. (XNYS:PLD)",0.00%,8.00%,1.00%,-21.00%,17.00%,-21.00%,-5.00%,-33.00%
PLTR,PALANTIR TECHNOLOGIES INC. (XNAS:PLTR),6.00%,21.00%,4.00%,-31.00%,96.00%,-31.00%,415.00%,121.00%
PM,Philip Morris International Inc. (XNYS:PM),2.00%,6.00%,1.00%,-14.00%,21.00%,-14.00%,42.00%,34.00%
PNC,"THE PNC FINANCIAL SERVICES GROUP, INC. (XNYS:PNC)",1.00%,8.00%,1.00%,-20.00%,18.00%,-20.00%,-20.00%,-9.00%
PNR,PENTAIR PUBLIC LIMITED COMPANY (XNYS:PNR),2.00%,9.00%,1.00%,-18.00%,32.00%,-18.00%,108.00%,61.00%
PNW,PINNACLE WEST CAPITAL CORPORATION (XNYS:PNW),0.00%,6.00%,1.00%,-7.00%,14.00%,-15.00%,28.00%,-21.00%
PODD,INSULET CORPORATION (XNAS:PODD),1.00%,13.00%,1.00%,-31.00%,36.00%,-31.00%,83.00%,35.00%
POOL,POOL CORPORATION (XNAS:POOL),-0.00%,9.00%,-1.00%,-21.00%,33.00%,-21.00%,155.00%,77.00%
PPG,"PPG INDUSTRIES, INC. (XNYS:PPG)",-0.00%,8.00%,-1.00%,-20.00%,20.00%,-20.00%,60.00%,32.00%
PPL,PPL CORPORATION (XNYS:PPL),1.00%,5.00%,1.00%,-15.00%,11.00%,-15.00%,42.00%,-42.00%
PRU,"PRUDENTIAL FINANCIAL, INC. (XNYS:PRU)",1.00%,7.00%,0.00%,-16.00%,22.00%,-16.00%,54.00%,39.00%
PSA,PUBLIC STORAGE. (XNYS:PSA),0.00%,6.00%,1.00%,-15.00%,15.00%,-15.00%,-2.00%,-13.00%
PSKY,PARAMOUNT SKYDANCE CORPORATION (XNAS:PSKY),0.00%,18.00%,-2.00%,-44.00%,76.00%,-44.00%,533.00%,156.00%
PSX,PHILLIPS 66 (XNYS:PSX),1.00%,10.00%,0.00%,-23.00%,28.00%,-23.00%,48.00%,23.00%
PTC,PTC INC. (XNAS:PTC),1.00%,8.00%,0.00%,-14.00%,19.00%,-14.00%,-25.00%,46.00%
PWR,"QUANTA SERVICES, INC. (XNYS:PWR)",4.00%,10.00%,4.00%,-25.00%,26.00%,-25.00%,48.00%,-30.00%
PYPL,"PAYPAL HOLDINGS, INC. (XNAS:PYPL)",-1.00%,13.00%,-1.00%,-39.00%,34.00%,-39.00%,125.00%,-23.00%
Q,"QNITY ELECTRONICS, INC. (XNYS:Q)",0.00%,2.00%,0.00%,0.00%,15.00%,-5.00%,5154.00%,667.00%
QCOM,QUALCOMM INCORPORATED (XNAS:QCOM),1.00%,10.00%,0.00%,-18.00%,33.00%,-18.00%,101.00%,81.00%
RCL,ROYAL CARIBBEAN CRUISES LTD. (XNYS:RCL),4.00%,15.00%,4.00%,-25.00%,44.00%,-25.00%,-8.00%,41.00%
REG,REGENCY CENTERS CORPORATION (XNAS:REG),1.00%,6.00%,0.00%,-14.00%,20.00%,-14.00%,135.00%,83.00%
REGN,"REGENERON PHARMACEUTICALS, INC. (XNAS:REGN)",1.00%,9.00%,2.00%,-26.00%,23.00%,-26.00%,99.00%,-54.00%
RF,REGIONS FINANCIAL CORPORATION (XNYS:RF),2.00%,10.00%,2.00%,-20.00%,21.00%,-20.00%,-65.00%,-2.00%
RJF,"RAYMOND JAMES FINANCIAL, INC. (XNYS:RJF)",3.00%,8.00%,3.00%,-13.00%,22.00%,-13.00%,-28.00%,11.00%
RL,RALPH LAUREN CORPORATION (XNYS:RL),3.00%,10.00%,4.00%,-21.00%,33.00%,-21.00%,115.00%,53.00%
RMD,RESMED INC. (XNYS:RMD),1.00%,9.00%,1.00%,-29.00%,19.00%,-29.00%,79.00%,-45.00%
ROK,"ROCKWELL AUTOMATION, INC. (XNYS:ROK)",2.00%,9.00%,2.00%,-25.00%,32.00%,-25.00%,234.00%,40.00%
ROL,"ROLLINS, INC. (XNYS:ROL)",1.00%,7.00%,1.00%,-13.00%,21.00%,-13.00%,37.00%,40.00%
ROP,"ROPER TECHNOLOGIES, INC. (XNAS:ROP)",-0.00%,5.00%,-0.00%,-12.00%,12.00%,-12.00%,-21.00%,1.00%
ROST,"ROSS STORES, INC. (XNAS:ROST)",1.00%,8.00%,1.00%,-18.00%,25.00%,-18.00%,3.00%,11.00%
RSG,"REPUBLIC SERVICES, INC. (XNYS:RSG)",1.00%,5.00%,1.00%,-9.00%,11.00%,-9.00%,-45.00%,-3.00%
RTX,RTX CORPORATION (XNYS:RTX),3.00%,6.00%,3.00%,-15.00%,16.00%,-15.00%,40.00%,-38.00%
RVTY,"REVVITY, INC. (XNYS:RVTY)",-0.00%,8.00%,1.00%,-18.00%,20.00%,-18.00%,-8.00%,10.00%
SBAC,SBA Communications Corporation (XNAS:SBAC),0.00%,7.00%,-0.00%,-17.00%,23.00%,-17.00%,53.00%,28.00%
SBUX,STARBUCKS CORPORATION (XNAS:SBUX),0.00%,8.00%,1.00%,-19.00%,21.00%,-19.00%,70.00%,5.00%
SCHW,THE CHARLES SCHWAB CORPORATION (XNYS:SCHW),2.00%,9.00%,3.00%,-35.00%,24.00%,-35.00%,372.00%,-84.00%
SHW,THE SHERWIN-WILLIAMS COMPANY (XNYS:SHW),1.00%,8.00%,-0.00%,-20.00%,16.00%,-20.00%,-41.00%,9.00%
SJM,THE J. M. SMUCKER COMPANY (XNYS:SJM),0.00%,6.00%,0.00%,-15.00%,13.00%,-15.00%,-29.00%,-29.00%
SLB,SLB N.V. (XNYS:SLB),2.00%,12.00%,-0.00%,-27.00%,48.00%,-27.00%,259.00%,97.00%
SMCI,"SUPER MICRO COMPUTER, INC. (XNAS:SMCI)",8.00%,26.00%,2.00%,-31.00%,81.00%,-31.00%,58.00%,98.00%
SNA,SNAP-ON INCORPORATED (XNYS:SNA),2.00%,7.00%,1.00%,-9.00%,18.00%,-9.00%,-62.00%,43.00%
SNDK,SANDISK CORPORATION (XNAS:SNDK),7.00%,27.00%,0.00%,0.00%,129.00%,-43.00%,1174.00%,331.00%
SNPS,"SYNOPSYS, INC. (XNAS:SNPS)",2.00%,12.00%,3.00%,-20.00%,24.00%,-20.00%,-98.00%,1.00%
SO,THE SOUTHERN COMPANY (XNYS:SO),1.00%,5.00%,1.00%,-13.00%,13.00%,-13.00%,-15.00%,-14.00%
SOLV,SOLVENTUM CORPORATION (XNYS:SOLV),1.00%,4.00%,0.00%,0.00%,18.00%,-16.00%,672.00%,48.00%
SPG,"SIMON PROPERTY GROUP, INC. (XNYS:SPG)",2.00%,10.00%,2.00%,-14.00%,29.00%,-14.00%,86.00%,86.00%
SPGI,S&P Global Inc. (XNYS:SPGI),1.00%,7.00%,2.00%,-16.00%,19.00%,-16.00%,-2.00%,-30.00%
SRE,SEMPRA (XNYS:SRE),1.00%,6.00%,1.00%,-17.00%,13.00%,-17.00%,14.00%,-24.00%
STE,STERIS PUBLIC LIMITED COMPANY (XNYS:STE),1.00%,7.00%,0.00%,-17.00%,19.00%,-17.00%,-33.00%,19.00%
STLD,"STEEL DYNAMICS, INC. (XNAS:STLD)",4.00%,12.00%,3.00%,-18.00%,41.00%,-18.00%,112.00%,94.00%
STT,STATE STREET CORPORATION (XNYS:STT),2.00%,8.00%,1.00%,-18.00%,24.00%,-18.00%,58.00%,20.00%
STX,SEAGATE TECHNOLOGY HOLDINGS PUBLIC LIMITED COMPANY (XNAS:STX),4.00%,14.00%,3.00%,-29.00%,49.00%,-29.00%,166.00%,74.00%
STZ,"CONSTELLATION BRANDS, INC. (XNYS:STZ)",-0.00%,7.00%,0.00%,-23.00%,12.00%,-23.00%,188.00%,-101.00%
SW,SMURFIT WESTROCK PUBLIC LIMITED COMPANY (XNYS:SW),1.00%,9.00%,0.00%,0.00%,28.00%,-21.00%,83.00%,18.00%
SWK,"STANLEY BLACK & DECKER, INC. (XNYS:SWK)",-0.00%,10.00%,-1.00%,-29.00%,25.00%,-29.00%,23.00%,7.00%
SWKS,"SKYWORKS SOLUTIONS, INC. (XNAS:SWKS)",-1.00%,10.00%,-1.00%,-26.00%,24.00%,-26.00%,66.00%,24.00%
SYF,SYNCHRONY FINANCIAL (XNYS:SYF),2.00%,10.00%,2.00%,-19.00%,24.00%,-19.00%,-37.00%,-0.00%
SYK,STRYKER CORPORATION (XNYS:SYK),1.00%,6.00%,1.00%,-11.00%,16.00%,-11.00%,-13.00%,40.00%
SYY,SYSCO CORPORATION (XNYS:SYY),0.00%,6.00%,-0.00%,-2.00%,16.00%,-15.00%,107.00%,31.00%
T,AT&T INC. (XNYS:T),0.00%,7.00%,0.00%,-14.00%,19.00%,-14.00%,55.00%,31.00%
TAP,MOLSON COORS BEVERAGE COMPANY (XNYS:TAP),-1.00%,8.00%,1.00%,-17.00%,17.00%,-17.00%,-29.00%,-5.00%
TDG,TRANSDIGM GROUP INCORPORATED (XNYS:TDG),2.00%,7.00%,2.00%,-17.00%,18.00%,-17.00%,8.00%,-20.00%
TDY,TELEDYNE TECHNOLOGIES INCORPORATED (XNYS:TDY),1.00%,7.00%,1.00%,1.00%,17.00%,-14.00%,3.00%,-15.00%
TECH,BIO-TECHNE CORPORATION (XNAS:TECH),0.00%,11.00%,-0.00%,-23.00%,30.00%,-23.00%,16.00%,25.00%
TEL,TE CONNECTIVITY PUBLIC LIMITED COMPANY (XNYS:TEL),2.00%,7.00%,1.00%,-13.00%,22.00%,-13.00%,56.00%,61.00%
TER,"TERADYNE, INC. (XNAS:TER)",3.00%,14.00%,1.00%,-30.00%,50.00%,-30.00%,91.00%,46.00%
TFC,Truist Financial Corporation (XNYS:TFC),1.00%,9.00%,1.00%,-28.00%,21.00%,-28.00%,91.00%,-25.00%
TGT,TARGET CORPORATION (XNYS:TGT),-1.00%,10.00%,-1.00%,-28.00%,21.00%,-28.00%,37.00%,-14.00%
TJX,"THE TJX COMPANIES, INC. (XNYS:TJX)",2.00%,6.00%,2.00%,-12.00%,15.00%,-12.00%,3.00%,-18.00%
TKO,"TKO GROUP HOLDINGS, INC. (XNYS:TKO)",3.00%,10.00%,4.00%,-26.00%,31.00%,-26.00%,105.00%,-5.00%
TMO,THERMO FISHER SCIENTIFIC INCORPORATED (XNYS:TMO),1.00%,7.00%,2.00%,-18.00%,13.00%,-18.00%,-44.00%,-35.00%
TMUS,"T-MOBILE US, INC. (XNAS:TMUS)",1.00%,7.00%,1.00%,-11.00%,21.00%,-11.00%,13.00%,43.00%
TPL,TEXAS PACIFIC LAND CORPORATION (XNYS:TPL),4.00%,17.00%,0.00%,-24.00%,63.00%,-24.00%,176.00%,120.00%
TPR,"TAPESTRY, INC. (XNYS:TPR)",4.00%,12.00%,3.00%,-22.00%,31.00%,-22.00%,-28.00%,13.00%
TRGP,TARGA RESOURCES CORP. (XNYS:TRGP),4.00%,10.00%,3.00%,-18.00%,27.00%,-18.00%,-37.00%,22.00%
TRMB,TRIMBLE INC. (XNAS:TRMB),1.00%,9.00%,1.00%,-19.00%,21.00%,-19.00%,3.00%,9.00%
TROW,"T. ROWE PRICE GROUP, INC. (XNAS:TROW)",0.00%,8.00%,1.00%,-24.00%,19.00%,-24.00%,52.00%,-34.00%
TRV,"The Travelers Companies, Inc. (XNYS:TRV)",2.00%,6.00%,1.00%,-8.00%,19.00%,-8.00%,26.00%,54.00%
TSCO,TRACTOR SUPPLY COMPANY (XNAS:TSCO),1.00%,6.00%,0.00%,-12.00%,14.00%,-12.00%,-44.00%,6.00%
TSLA,"TESLA, INC. (XNAS:TSLA)",4.00%,20.00%,3.00%,-37.00%,60.00%,-37.00%,85.00%,80.00%
TSN,"TYSON FOODS, INCORPORATED (XNYS:TSN)",-0.00%,7.00%,-0.00%,-16.00%,14.00%,-16.00%,-28.00%,-18.00%
TT,Trane Technologies plc (XNYS:TT),2.00%,9.00%,2.00%,-21.00%,27.00%,-21.00%,74.00%,12.00%
TTD,"THE TRADE DESK, INC. (XNAS:TTD)",1.00%,18.00%,1.00%,-40.00%,47.00%,-40.00%,10.00%,17.00%
TTWO,"TAKE-TWO INTERACTIVE SOFTWARE, INC. (XNAS:TTWO)",1.00%,9.00%,2.00%,-25.00%,21.00%,-25.00%,46.00%,-37.00%
TXN,TEXAS INSTRUMENTS INCORPORATED (XNAS:TXN),1.00%,8.00%,1.00%,-16.00%,25.00%,-16.00%,89.00%,64.00%
TXT,TEXTRON INC. (XNYS:TXT),1.00%,7.00%,0.00%,-13.00%,18.00%,-13.00%,-33.00%,35.00%
TYL,"TYLER TECHNOLOGIES, INC. (XNYS:TYL)",1.00%,9.00%,1.00%,-18.00%,25.00%,-18.00%,81.00%,47.00%
UAL,"UNITED AIRLINES HOLDINGS, INC. (XNAS:UAL)",3.00%,14.00%,3.00%,-28.00%,43.00%,-28.00%,26.00%,55.00%
UBER,"UBER TECHNOLOGIES, INC. (XNYS:UBER)",2.00%,14.00%,3.00%,-28.00%,50.00%,-28.00%,164.00%,71.00%
UDR,"UDR, INC. (XNYS:UDR)",0.00%,6.00%,1.00%,-15.00%,14.00%,-15.00%,-8.00%,5.00%
UHS,"UNIVERSAL HEALTH SERVICES, INC. (XNYS:UHS)",1.00%,11.00%,0.00%,-17.00%,29.00%,-17.00%,-5.00%,49.00%
ULTA,"ULTA BEAUTY, INC. (XNAS:ULTA)",2.00%,8.00%,2.00%,-22.00%,18.00%,-22.00%,52.00%,-48.00%
UNH,UNITEDHEALTH GROUP INCORPORATED (XNYS:UNH),-0.00%,8.00%,-0.00%,-35.00%,18.00%,-35.00%,544.00%,-121.00%
UNP,UNION PACIFIC CORPORATION (XNYS:UNP),0.00%,6.00%,-0.00%,-16.00%,18.00%,-16.00%,123.00%,34.00%
UPS,"UNITED PARCEL SERVICE, INC. (XNYS:UPS)",-0.00%,8.00%,0.00%,-19.00%,23.00%,-19.00%,15.00%,16.00%
URI,"UNITED RENTALS, INC. (XNYS:URI)",3.00%,11.00%,4.00%,-17.00%,32.00%,-17.00%,-29.00%,29.00%
USB,U.S. BANCORP (XNYS:USB),1.00%,9.00%,-1.00%,-24.00%,24.00%,-24.00%,55.00%,22.00%
V,VISA INC. (XNYS:V),1.00%,5.00%,1.00%,-12.00%,11.00%,-12.00%,-9.00%,-34.00%
VICI,VICI PROPERTIES INC. (XNYS:VICI),0.00%,5.00%,-1.00%,-11.00%,12.00%,-11.00%,-65.00%,10.00%
VLO,VALERO ENERGY CORPORATION (XNYS:VLO),3.00%,12.00%,3.00%,-24.00%,34.00%,-24.00%,-7.00%,28.00%
VLTO,VERALTO CORPORATION (XNYS:VLTO),1.00%,4.00%,0.00%,0.00%,15.00%,-9.00%,288.00%,129.00%
VMC,VULCAN MATERIALS COMPANY (XNYS:VMC),2.00%,7.00%,2.00%,-13.00%,21.00%,-13.00%,-20.00%,26.00%
VRSK,"VERISK ANALYTICS, INC. (XNAS:VRSK)",0.00%,7.00%,0.00%,-14.00%,17.00%,-14.00%,-32.00%,0.00%
VRSN,"VERISIGN, INC. (XNAS:VRSN)",0.00%,7.00%,0.00%,-24.00%,16.00%,-24.00%,186.00%,-50.00%
VRTX,VERTEX PHARMACEUTICALS INCORPORATED (XNAS:VRTX),1.00%,7.00%,1.00%,-16.00%,17.00%,-16.00%,-7.00%,-7.00%
VST,VISTRA CORP. (XNYS:VST),5.00%,14.00%,4.00%,-22.00%,55.00%,-22.00%,223.00%,104.00%
VTR,"VENTAS, INC. (XNYS:VTR)",1.00%,8.00%,-0.00%,-1.00%,17.00%,-17.00%,-39.00%,17.00%
VTRS,VIATRIS INC. (XNAS:VTRS),0.00%,11.00%,-0.00%,-30.00%,21.00%,-30.00%,-25.00%,-19.00%
VZ,VERIZON COMMUNICATIONS INC. (XNYS:VZ),-1.00%,6.00%,-2.00%,-13.00%,18.00%,-13.00%,140.00%,61.00%
WAB,WESTINGHOUSE AIR BRAKE TECHNOLOGIES CORPORATION (XNYS:WAB),3.00%,7.00%,2.00%,-12.00%,18.00%,-12.00%,-27.00%,39.00%
WAT,WATERS CORPORATION (XNYS:WAT),1.00%,9.00%,2.00%,-19.00%,15.00%,-19.00%,-45.00%,-45.00%
WBD,"WARNER BROS. DISCOVERY, INC. (XNAS:WBD)",2.00%,20.00%,-4.00%,-35.00%,67.00%,-35.00%,245.00%,142.00%
WDAY,"WORKDAY, INC. (XNAS:WDAY)",-0.00%,9.00%,-1.00%,-20.00%,24.00%,-20.00%,-54.00%,15.00%
WDC,WESTERN DIGITAL CORPORATION (XNAS:WDC),5.00%,15.00%,4.00%,-28.00%,42.00%,-28.00%,-5.00%,37.00%
WEC,WEC ENERGY GROUP INC. (XNYS:WEC),0.00%,5.00%,1.00%,-15.00%,14.00%,-15.00%,81.00%,-24.00%
WELL,WELLTOWER INC. (XNYS:WELL),2.00%,7.00%,1.00%,-17.00%,17.00%,-17.00%,22.00%,-1.00%
WFC,WELLS FARGO & COMPANY (XNYS:WFC),3.00%,9.00%,2.00%,-20.00%,23.00%,-20.00%,-39.00%,-13.00%
WM,"WASTE MANAGEMENT, INC. (XNYS:WM)",1.00%,5.00%,1.00%,7.00%,13.00%,-13.00%,13.00%,3.00%
WMB,"THE WILLIAMS COMPANIES, INC. (XNYS:WMB)",3.00%,7.00%,2.00%,-18.00%,17.00%,-18.00%,37.00%,-2.00%
WMT,WALMART INC. (XNAS:WMT),2.00%,6.00%,2.00%,-17.00%,12.00%,-17.00%,202.00%,-96.00%
WRB,W. R. BERKLEY CORPORATION (XNYS:WRB),2.00%,6.00%,1.00%,-11.00%,17.00%,-11.00%,7.00%,33.00%
WSM,"WILLIAMS-SONOMA, INC. (XNYS:WSM)",3.00%,14.00%,1.00%,-24.00%,43.00%,-24.00%,130.00%,84.00%
WST,"WEST PHARMACEUTICAL SERVICES, INC. (XNYS:WST)",-0.00%,11.00%,2.00%,-39.00%,23.00%,-39.00%,174.00%,-88.00%
WTW,Willis Towers Watson Public Limited Company (XNAS:WTW),2.00%,6.00%,1.00%,-11.00%,19.00%,-11.00%,28.00%,24.00%
WY,WEYERHAEUSER COMPANY (XNYS:WY),-0.00%,7.00%,-1.00%,-19.00%,19.00%,-19.00%,8.00%,5.00%
WYNN,"WYNN RESORTS, LIMITED (XNAS:WYNN)",1.00%,12.00%,-1.00%,-19.00%,46.00%,-19.00%,238.00%,118.00%
XEL,Xcel Energy Inc. (XNAS:XEL),0.00%,5.00%,1.00%,-15.00%,11.00%,-15.00%,22.00%,-39.00%
XOM,EXXON MOBIL CORPORATION (XNYS:XOM),2.00%,9.00%,1.00%,-14.00%,33.00%,-14.00%,228.00%,113.00%
XYL,XYLEM INC. (XNYS:XYL),1.00%,8.00%,1.00%,-25.00%,23.00%,-25.00%,157.00%,9.00%
XYZ,"BLOCK, INC. (XNYS:XYZ)",-0.00%,17.00%,-1.00%,-33.00%,37.00%,-33.00%,-46.00%,19.00%
YUM,"YUM! BRANDS, INC. (XNYS:YUM)",1.00%,6.00%,0.00%,-10.00%,16.00%,-10.00%,13.00%,54.00%
ZBH,"ZIMMER BIOMET HOLDINGS, INC. (XNYS:ZBH)",-1.00%,6.00%,-0.00%,2.00%,14.00%,-14.00%,-32.00%,4.00%
ZBRA,ZEBRA TECHNOLOGIES CORPORATION (XNAS:ZBRA),1.00%,12.00%,1.00%,-25.00%,29.00%,-25.00%,-28.00%,11.00%
ZTS,ZOETIS INC. (XNYS:ZTS),-0.00%,8.00%,0.00%,-18.00%,16.00%,-18.00%,-59.00%,-6.00%
